{
  "actor_upn": "meganb@cloudharbor-demo.com",
  "borrowed_client_id": "14d82eec-204b-4c2f-b7e8-296a70dab67e",
  "completed_at_utc": "2026-05-15T14:35:01.000000Z",
  "entry_id": "11111111-1111-4111-8111-111111111111",
  "kind": "graph_call",
  "outcome": "success",
  "request": {
    "method": "GET",
    "url": "https://graph.microsoft.com/v1.0/users"
  },
  "response": {
    "page_count": 1,
    "row_count": 0,
    "status_code": 200
  },
  "schema_version": "0.2",
  "started_at_utc": "2026-05-15T14:35:00.000000Z",
  "technique": {
    "id": "T1087.004",
    "name": "Account Discovery: Cloud Account"
  },
  "tenant_id": "76b87c33-6178-4ff9-94a7-164792c8e4c6",
  "tool": "tool_list_users"
}
